{
  "$schema": "schema/presentation-cases.schema.json",
  "schema_version": "1.0",
  "benchmark_id": "agentic-reporting-presentation-v1",
  "claim_boundary": "Checked-in fixtures exercise the evaluator only. They do not measure a model and cannot support a framework-improvement claim.",
  "suites": [
    {
      "id": "harness-smoke",
      "kind": "harness_only",
      "case_ids": [
        "short-direct-status",
        "engineering-late-failure",
        "experiment-null-result",
        "image-anomaly-boundary",
        "multi-table-incomparable",
        "paper-summary-bounded",
        "incident-rollback-not-resolved",
        "ablation-component-contribution",
        "benchmark-speedup-honest"
      ]
    },
    {
      "id": "public-research-pilot",
      "kind": "generation",
      "case_ids": ["paper-dpo-scope", "paper-rliable-ranking"]
    }
  ],
  "cases": [
    {
      "id": "short-direct-status",
      "scenario": "short_answer",
      "request": "Answer in at most two compact sentences: Did the corpus build succeed, and what remains?",
      "facts": [
        "The corpus build succeeded.",
        "Direct paper linkage is 88 of the 100-paper target.",
        "Twelve papers remain to reach the target."
      ],
      "evidence_boundary": "State only the supplied build result and coverage gap. Do not call the entire project complete.",
      "artifacts": [],
      "report_profile": "concise-answer",
      "expected_route": {"mode": "concise-answer", "modules": []},
      "required_semantic_slots": ["direct_answer", "remaining_boundary"],
      "visual_oracle": {
        "necessity": "forbidden",
        "allowed_types": [],
        "rationale": "Two scalar facts are clearer as two sentences than as a display."
      },
      "budgets": {"max_output_words": 70},
      "machine_checks": [
        {
          "id": "answer-first",
          "type": "required_regex",
          "pattern": "\\A(?:yes\\b|the corpus build succeeded|build succeeded)",
          "message": "Lead with the direct build result."
        },
        {
          "id": "preserve-coverage",
          "type": "required_regex",
          "pattern": "88\\s*/\\s*100|88 (?:of|out of) (?:the )?100",
          "message": "Preserve the 88-of-100 coverage state."
        },
        {
          "id": "preserve-gap",
          "type": "required_regex",
          "pattern": "(?:twelve|12) papers? remain",
          "message": "State the remaining twelve-paper gap."
        },
        {
          "id": "avoid-false-completion",
          "type": "forbidden_regex",
          "pattern": "all (?:work|coverage|the work) is complete|nothing remains|fully complete",
          "message": "Do not report the full project as complete."
        },
        {"id": "short-budget", "type": "max_words", "value": 70, "message": "Keep the short answer proportionate."},
        {"id": "no-headings", "type": "max_headings", "value": 0, "message": "Do not add headings to a two-sentence answer."},
        {"id": "no-table", "type": "max_markdown_tables", "value": 0, "message": "Do not add a table for two scalar facts."},
        {"id": "no-image", "type": "forbidden_image", "message": "Do not add an image to this short answer."}
      ]
    },
    {
      "id": "engineering-late-failure",
      "scenario": "long_engineering",
      "request": "Give the final engineering handoff after the parser change and the late integration-test failure.",
      "facts": [
        "The parser change was implemented in parser.py.",
        "All 42 unit tests passed.",
        "The final integration test exited with status 1 because the registry credential was rejected.",
        "The work is not complete until the integration test can run successfully.",
        "The next action is to renew the registry credential and rerun the integration test."
      ],
      "evidence_boundary": "Report the successful unit evidence and the later blocking failure. Do not let the earlier success overwrite the final state.",
      "artifacts": [],
      "report_profile": "implementation-handoff+evidence",
      "expected_route": {"mode": "implementation-handoff", "modules": ["evidence"]},
      "required_semantic_slots": ["current_status", "changes", "verification", "blocker", "next_action"],
      "visual_oracle": {
        "necessity": "forbidden",
        "allowed_types": [],
        "rationale": "A compact handoff communicates this single change and blocker without a visual."
      },
      "budgets": {"max_output_words": 320},
      "machine_checks": [
        {
          "id": "not-complete",
          "type": "required_regex",
          "pattern": "blocked|not complete|partially complete|integration (?:test )?failed",
          "message": "Make the final blocked state explicit."
        },
        {
          "id": "changed-file",
          "type": "required_regex",
          "pattern": "parser\\.py",
          "message": "Name the changed file."
        },
        {
          "id": "unit-evidence",
          "type": "required_regex",
          "pattern": "(?:all\\s+42\\s+unit tests?\\s+passed|unit tests?:?\\s+(?:all\\s+)?42\\s+passed|42(?:/42)?\\s+unit tests?\\s+passed)",
          "message": "Preserve the passing unit-test evidence."
        },
        {
          "id": "integration-failure",
          "type": "required_regex",
          "pattern": "integration test.*(?:exit(?:ed)? (?:with )?(?:status )?1|failed)|(?:exit(?:ed)? (?:with )?(?:status )?1|failed).*integration test",
          "message": "Report the late integration-test failure and status."
        },
        {
          "id": "credential-boundary",
          "type": "required_regex",
          "pattern": "registry credential.*(?:rejected|renew)|(?:renew|rejected).*registry credential",
          "message": "Report the credential blocker or its next action."
        },
        {
          "id": "next-action",
          "type": "required_regex",
          "pattern": "renew.*credential.*rerun|rerun.*after.*credential",
          "message": "State the concrete recovery action."
        },
        {
          "id": "no-false-pass",
          "type": "forbidden_regex",
          "pattern": "all tests (?:now )?pass(?:ed)?|completed successfully|implementation is complete",
          "message": "Do not erase the late integration failure."
        },
        {"id": "engineering-budget", "type": "max_words", "value": 320, "message": "Keep the handoff bounded."},
        {"id": "no-engineering-image", "type": "forbidden_image", "message": "Do not add a decorative image."},
        {"id": "no-placeholders", "type": "forbidden_placeholder", "message": "Do not leave handoff placeholders unresolved."}
      ]
    },
    {
      "id": "experiment-null-result",
      "scenario": "experiment_analysis",
      "request": "Present the benchmark in one self-contained quantitative table and give a calibrated conclusion about the accuracy/latency trade-off.",
      "facts": [
        "Accuracy is higher-is-better and is reported as mean plus or minus standard deviation over five seeds.",
        "Method A accuracy is 72.4 plus or minus 1.1 percent and latency is 31 milliseconds.",
        "Method B accuracy is 74.0 plus or minus 1.0 percent and latency is 38 milliseconds.",
        "Method C accuracy is 73.9 plus or minus 0.9 percent and latency is 29 milliseconds.",
        "Latency is lower-is-better.",
        "No significance test was run, so B and C cannot be declared statistically different."
      ],
      "evidence_boundary": "Describe observed means and the accuracy/latency trade-off. Do not claim statistical significance, causality, or a universal winner.",
      "artifacts": [],
      "report_profile": "experiment-report+tables",
      "expected_route": {"mode": "experiment-report", "modules": ["tables"]},
      "required_semantic_slots": ["protocol", "quantitative_display", "verified_result", "uncertainty_boundary", "tradeoff_conclusion"],
      "visual_oracle": {
        "necessity": "required",
        "allowed_types": ["quantitative_table"],
        "rationale": "Three methods on two metrics are most accurately compared in one compact table."
      },
      "budgets": {"max_output_words": 400},
      "machine_checks": [
        {"id": "one-table-min", "type": "min_markdown_tables", "value": 1, "message": "Present the quantitative comparison in a table."},
        {"id": "one-table-max", "type": "max_markdown_tables", "value": 1, "message": "Use exactly one compact table."},
        {"id": "five-seeds", "type": "required_regex", "pattern": "(?:five|5) seeds", "message": "Report the five-seed protocol."},
        {"id": "method-a-values", "type": "required_regex", "pattern": "72\\.4\\s*(?:±|\\+/-|\\+\\s*or\\s*-).*1\\.1.*31", "message": "Preserve Method A values."},
        {"id": "method-b-values", "type": "required_regex", "pattern": "74\\.0\\s*(?:±|\\+/-|\\+\\s*or\\s*-).*1\\.0.*38", "message": "Preserve Method B values."},
        {"id": "method-c-values", "type": "required_regex", "pattern": "73\\.9\\s*(?:±|\\+/-|\\+\\s*or\\s*-).*0\\.9.*29", "message": "Preserve Method C values."},
        {"id": "metric-directions", "type": "required_regex", "pattern": "higher.{0,20}better.*lower.{0,20}better|accuracy.{0,20}↑.*latency.{0,20}↓", "message": "Make both metric directions clear."},
        {"id": "significance-boundary", "type": "required_regex", "pattern": "no (?:statistical )?significance test|significance (?:was )?not (?:tested|assessed)|cannot be declared statistically", "message": "State that significance was not tested."},
        {"id": "no-significant-claim", "type": "forbidden_regex", "pattern": "statistically significant|significantly (?:better|higher|outperforms?)", "message": "Do not claim an untested significant difference."},
        {"id": "experiment-budget", "type": "max_words", "value": 400, "message": "Keep the analysis bounded."}
      ]
    },
    {
      "id": "image-anomaly-boundary",